{
  "page": 1,
  "pages": 12,
  "perpage": 100,
  "total": 1183,
  "photoset": [
    {
      "id": "52345678901",
      "primary": "52345678901",
      "owner": "12345678@N00",
      "title": {
        "_content": "100"
      },
      "description": {
        "_content": "100"
      },
      "photos": 248,
      "videos": 3
    }
  ]
}